Date,Name,Year,Letterboxd URI,Rating,Rewatch,Review,Tags,Watched Date
2025-03-14,The Pianist,2002,https://boxd.it/97b8q9,4.5,,"Um dos filmes que mais retrata a destruição em ambiente da 2° guerra, cenários desconfigurados, futuro desconhecido e semblantes desesperados

absurdo",l,2025-03-13
2025-03-15,Funny Games,1997,https://boxd.it/97zLFv,4,,🥚🥚🥚🥚,l,2025-03-14
2025-03-22,Mainstream Sellout Live From Cleveland: The Pink Era,2023,https://boxd.it/9bXben,3,Yes,PUNK IS ALIVE,l,2025-03-17
2025-03-22,Downfalls High,2021,https://boxd.it/9c8Quj,3,Yes,IM SELLIN TICKETS TO MY DOWNFALLLLLLLLLLLLLLLLLLLLLLLLLLLll,lia 💍,2025-03-23
2025-03-27,Olivia Rodrigo: GUTS World Tour,2024,https://boxd.it/9f61cL,4,Yes,"GUTS WORLD TOUR SPILLED - CURITIBA 26/03/2025

Pra ser 5 só faltou dar a devida importância pra um show solo..

GUTSY","l, cine25",2025-03-27
2025-04-07,Final Destination 2,2003,https://boxd.it/9kTjXj,2,,nao tao iconico quanto o 1°,l,2025-04-05
2025-04-13,The Wild Robot,2024,https://boxd.it/9oyMZR,4,Yes,tao lindinho,ospinos,2025-04-10
2025-04-21,Scary Movie,2000,https://boxd.it/9sZTTr,3,,peakhorror,l,2025-04-19
2025-05-05,Catch Me If You Can,2002,https://boxd.it/9BxQq7,4.5,Yes,O desenvolvimento desse filme é ABSURDO,ospinos,2025-05-03
2025-05-13,Scary Movie 3,2003,https://boxd.it/9G0NvH,1.5,,bom e burro,l,2025-05-09
2025-05-17,Uncut Gems,2019,https://boxd.it/9Ip1Oz,3.5,,agoniante af,ospinos,2025-05-16
2025-05-18,The Shawshank Redemption,1994,https://boxd.it/9IZQ8r,5,Yes,hope,ospinos,2025-05-17
2025-05-24,Fear Street: Prom Queen,2025,https://boxd.it/9MHVxL,0.5,,"UM DOS PIORES FILMES JÁ FEITOS

ÚNICA COISA QUE SE SALVA É A PLAYLIST",l,2025-05-23
2025-06-01,WHAT DID JACK DO?,2017,https://boxd.it/9Rs6Ln,4,Yes,I KNOW WHY THE CHICKEN CROSSED THE ROAD,lia 💍,2025-05-31
2025-06-04,Kung Fu Panda 2,2011,https://boxd.it/9TxOJD,4,Yes,apice das animacoes,l,2025-06-03
2025-06-07,Mamma Mia!,2008,https://boxd.it/9VlPFB,4,Yes,DIGGIN THE DANCING QUEEN,lia 💍,2025-06-06
2025-06-08,Mission: Impossible – Dead Reckoning,2023,https://boxd.it/9VYBTR,2.5,,esperava mais tbf,ospinos,2025-06-07
2025-06-13,Pulp Fiction,1994,https://boxd.it/9ZbKG1,5,Yes,EZEQUIEL 25:17,lia 💍,2025-06-12
2025-06-14,O Rei do Cagaço,1977,https://boxd.it/9ZRkyT,0.5,,que horror,,2025-06-13
2025-06-15,Pulp Fiction,1994,https://boxd.it/a0wdwD,5,Yes,Gratidão.,ospinos,2025-06-14
2025-06-15,Saw III,2006,https://boxd.it/a0ws9J,3.5,Yes,"do you wanna play a game
",,2025-06-05
2025-06-20,Whiplash,2014,https://boxd.it/a3AkwF,4.5,Yes,Faster,"ospinos, namementioned",2025-06-24
2025-06-25,28 Days Later,2002,https://boxd.it/a6NqRx,4,,A classic,l,2025-06-19
2025-06-25,28 Weeks Later,2007,https://boxd.it/a6Sgm5,1.5,,a forma como a infecção retorna é tão doentia,l,2025-06-24
2025-06-28,In the Mood for Love,2000,https://boxd.it/a8VmmT,4,,E zas e zas e zas,"luigimec, fefys, lia 💍",2025-06-27
2025-06-29,A Charlie Brown Valentine,2002,https://boxd.it/a9G1Pf,2,,mal teve o snoopy,lia 💍,2025-06-29
2025-07-01,Chungking Express,1994,https://boxd.it/aaDljL,4,,amo minha namorada,lia 💍,2025-06-30
2025-07-02,Antichrist,2009,https://boxd.it/abA8kf,4,,"Humans, Nature, Chaos, Evil, Pleasure… or just Humans? Or even better, Nature.


It reigns..",l,2025-07-01
2025-07-03,Melancholia,2011,https://boxd.it/acfsgp,4,,"Filme aborda temas mentais muito bem e de forma diferente, de fato, mediante a uma situação crítica podemos ver como a ""essência"" das pessoas reage.

O narcisista prefere morrer a aceitar que estava errado
A ansiosa tenta fazer de tudo e se deteriora o máximo até o inevitável
A destruída se encontra, uma vez que tem certeza que tudo acabará para todos, já que ela sempre se sentia assim e essa situação gera uma empatia forçada

Sinto um pouco de falta do toque do Lars que sempre vi em outros filmes dele, mas é um ótimo filme, ainda mais que ele fez ele com base numa sessão própria

O filme peca em umas coisas e poderia ser mais refinado ou genial, mas continua sendo um bom filme, não sei se foi impressão minha, mas o pace me irritou, tem uma clara diferença de ritmo entre o ato1 e ato2 que me incomodou, entretanto, com o passar do tempo só tenho olhos bons pra esse filme","l, namementioned",2025-07-02
2025-07-04,Nymphomaniac: Vol. I,2013,https://boxd.it/acDQIF,3,,"Gosto muito do Lars e estou acostumado com seu perfil, mas não curti muito e nem verei a parte 2 por agora

Gostei muito da trilogia da depressao e especialmente por Anticristo e Melancolia, acho que esse 3° filme podia ser diferente mesmo abordando esse tema…",l,2025-07-02
2025-07-04,F1,2025,https://boxd.it/ad23mP,4,,"This movie could easily star Nico Hulkenberg & Gabriel Bortoleto

Hans Zimmer fucking did it again","l, namementioned, cine25, cine",2025-07-03
2025-07-05,Sinners,2025,https://boxd.it/adlVnv,4,,"muito fechadinho, muito bom filme",l,2025-07-04
2025-07-07,Mirage,2018,https://boxd.it/afgUqL,3,,"bom filme, mas nao tao bom como invisible guest","lia 💍, namementioned",2025-07-06
2025-07-08,God's Crooked Lines,2022,https://boxd.it/afYkVB,2.5,,o filme tem boas reviravoltas mas não chega a lugar nenhum,"lia 💍, namementioned",2025-07-07
2025-07-11,Source Code,2011,https://boxd.it/aieVsr,3.5,,"Bem simples e legalzinho, Jake Gylenhaal é mt fodao

Rutledge dá mt raiva e a goodwin começa omissa, mas o filme se desenrola bem","l, namementioned",2025-07-11
2025-07-12,The Seventh Seal,1957,https://boxd.it/aijclv,5,,"Faith is like loving someone in the dark who never comes,
no matter how you call

I don't regret anything but I'm a little tired

I AM THE UNKNOWING

you with your visions and dreams...","l, namementioned",2025-07-11
2025-07-12,Superman,2025,https://boxd.it/aiQIk1,3.5,,"Adoro a persona Super-Homem X Clark Kent, ainda como humano, age como comum, nunca fazendo proveito de seus poderes e autoridade, assim, demonstra a sua natureza, ele não é o super-homem, ele é o super-humano. Como herói, traz esperança, otimismo, e, acima de tudo, igualdade e justiça, todo é só mais um, e, todo um, merece a chance de viver livremente, independente de natureza.

E, por ser humano, está apto a errar em suas decisões, mas, sempre age de acordo com os seus ideais, o qual considera a humanidade como a sua família, visto que em uma das cenas finais temos uma quebra de expectativa sensacional, vão mostrar clipes de seus pais e, o clipe apresentado, são dos pais arkansanos... ( em vez do polêmico clipe anafórico dos pais de krypton).

O que não gostei: Lex; Achei a atuação e personificação ruins e meio simples algumas partes

Acho que o que faltou pra eu gostar mais foi realmente me conectar  profundamente com o Kal-El","cine, cine25, julio, namementioned",2025-07-11
2025-07-14,28 Years Later,2025,https://boxd.it/akhZKX,3,,"Esperava mais, mas ainda esperançoso sobre bone temple",l,2025-07-13
2025-07-14,Dead Poets Society,1989,https://boxd.it/akrBAp,3.5,,Antes morrer livre que viver uma vida preso,"fefys, pinguas, namementioned, lia 💍",2025-07-13
2025-07-16,Perfect Days,2023,https://boxd.it/alUPnV,5,,"O meu maior objetivo pra esse ano é “ ser mais leve” e é impressionante como essa é a mensagem que esse filme passa.

A nossa vida seria muito menos estressante e ansiosa se, em vez de nos preocupássemos tanto com futuro e passado, apenas vivêssemos o presente, mas o filme não faz isso de forma romantizada, ele demonstra cada momento com toda sua pureza e realidade, desde as partes desgastantes até quando algo, por mais simples ou mínimo que seja, consegue mudar tudo.

A simplicidade é uma das coisas mais lindas do mundo, a paciência é uma virtude e poder apreciar cada momento na sua devida dose e instância é algo mágico, tocante e que até soa como utópico para mim.

Amei a trilha sonora, os personagens, a fotografia e, principalmente, a expressão pela narrativa.

Abrindo-me um pouco mais, eu escolhi ver esse filme hoje pois, hoje, saiu minha última nota do 7º semestre da minha graduação e eu achei que não iria conseguir apreciar esse filme adequadamente enquanto não tivesse certeza que tudo deu certo nos meus moldes, porém, a verdade é que eu queria ter a capacidade de me permitir fazer coisas enquanto pensamentos permeiam, enchem e exaustem a minha cabeça.

Talvez eu nem devesse ter esses pensamentos, apenas dar o meu melhor, progredir a cada dia e aproveitar o resto, só que eu pareço me sugar e me cobrar num ponto que acaba ficando muito estressante e desgastante.

Enfim, tudo que eu espero é poder seguir um dia sem ter ressalvas do passado e sem perder o sono com medo do futuro, eu quero ser eu o tempo todo, eu quero sempre estar presente na minha própria vida, quero ouvir cada música em seu próprio ritmo e quero me sentir bem comigo mesmo.

<blockquote>O mundo é formado por muitos mundos
Alguns estão conectados 
Outros, não</blockquote><blockquote>
-Tem tantas coisas que ainda não sei
-Acho que é assim que a vida acaba
-Será que as sombras ficam mais escuras quando se sobrepõem?
~Vamos descobrir
~(…) Vejo mais escura
-Não vejo diferença</blockquote><blockquote><i><b>Next time is next time, now is now</b></i></blockquote>It is a new dawn
It is a new day
It is a new life for me
And I’m feeling gooood","lia 💍, c",2025-07-15
2025-07-18,The Hateful Eight,2015,https://boxd.it/amWHwX,4.5,,Samuel L Jackson & Tarantino is a hell of a duo,l,2025-07-17
2025-07-19,The Worst Person in the World,2021,https://boxd.it/anNhE3,4,,"Eu entendo onde o filme quer chegar, o que ele quer comunicar sobre a Julie, sobre a vida, carreira, relacionamentos e indecisão, mas, simplesmente não consigo gostar tanto e provavelmente nunca vou rever, mas, parabéns...



Águas de março",l,2025-07-18
2025-07-19,The Guilty,2021,https://boxd.it/anRoRB,3,,"Filme linear, sólido, com bom twist, emoção e uma atuação TREMENDA do Jake Gylenhaal, ele é simples, mas é bom.

Ao logar descobri que ele é um remake de um homônimo, que pode até ser melhor que ele pela originalidade, mas, esse não deve nada.",l,2025-07-18
2025-07-19,The Godfather,1972,https://boxd.it/ao3SPp,5,,"Eu amo o quão foda esse filme é, super encaixado e, até agora, acho que foi o filme que vi que mais conseguiu me deixar atento quanto a ritmo, o filme tem tantos acontecimentos que seriam dignos de inúmeros filmes nos dias de hoje, porém, aqui, tudo está condensado em um só. 

não sei o que é melhor, ver o legado de Vito Corleone ou a ascensão de Michael, afinal, os dois são perfeitamente planejados e executados

esse filme me ensinou várias coisas sobre confiança, lealdade, justiça, resiliência, paciência, família e incisão.

No fim, é tudo sobre quem está ao seu lado e o que você tem a oferecer pro mundo.




I'll make him an offer he can't refuse.

A man who doesn't spend time with his family can never be a real man.

Great men are not born great, they grow great . 

Revenge is a dish that tastes best when served cold.

Never let anyone know what you are thinking.","luigimec, fefelios, tori, namementioned",2025-07-18
2025-07-20,One Day,2011,https://boxd.it/aoQP15,4,,um dos melhores filmes de romance do ano,lia 💍,2025-07-19
2025-07-21,Jurassic World: Fallen Kingdom,2018,https://boxd.it/apiT0B,2,Yes,"impressionante como cada filme da saga world foi pior, mas ainda assim vou ver o rebirth, pois dinossauros são muito fodas",ospinos,2025-07-20
2025-07-21,The Human Centipede 2 (Full Sequence),2011,https://boxd.it/apocUj,1,,mil vezes mais nojento e perturbador que o primeiro,l,2025-07-20
2025-07-22,Detachment,2011,https://boxd.it/aqi2u3,4,,"A realidade é dura.
Só me fez ver o quão privilegiado eu sou e o quão o Adrien Brody é fantástico

I'm taking one thing at a time

We all have problems and we all have things we are dealing with and we all take them home with us at night

Some of us believe we can make a difference 
and some times we wake up
and we realize we have failed

",l,2025-07-21
2025-07-23,Asteroid City,2023,https://boxd.it/arogDf,2.5,,"Gosto do Wes, mas isso foi demais, meta linguística demais…

Casting absurdo, só que não é bem aproveitado e isso me irritou MUITO","l, namementioned",2025-07-22
2025-07-23,The Swan,2023,https://boxd.it/aroLb7,3,,Moral da história: Nunca desista e siga seus ideais,l,2025-07-22
2025-07-24,The Cloverfield Paradox,2018,https://boxd.it/arMKdJ,1,,"O “paradox” me fez ver esse filme antes dos outros, mas é uma aberração

Talvez se eu tivesse algum cloverfield antigo poderia achar algo de interessante, porém, como não é o caso, não consegui",l,2025-07-23
2025-07-25,Man of Steel,2013,https://boxd.it/asrrn3,2.5,Yes,"Ao mesmo tempo que esse filme tem inúmeras cenas marcantes, ele tem várias inconsistências com o personagem superman e os quadrinhos

a nostalgia engana",l,2025-07-24
2025-07-25,Batman Begins,2005,https://boxd.it/asz19P,4,Yes,"Filmes de introdução tem um gostinho a mais sempre pra mim, ótima ponte pra construir apego e desenvolver os personagens e suas motivações, nesse caso, medos…

Cillian Murphy eu te amo tanto",l,2025-07-24
2025-07-25,The Dark Knight,2008,https://boxd.it/asOKlr,5,Yes,"O Batman é meu personagem favorito dos quadrinhos e esse filme o representa muito bem ele e seus dilemas, ao mesmo tempo que ele reconhece que um dia deve parar, ele prefere ser linchado publicamente que dar a vitória ao coringa, ele é o cavaleiro das trevas que sempre protegerá a bondade viva em gotham e, por mais que tudo no filme possa tentar te indicar que ela é inexistente, o final demonstra que ela vive, a esperança de uma gotham livre vive enquanto o Batman viver.

E nada melhor que, o melhor vilão de Gotham, alguém que faz a sua antítese perfeita, pra contracenar contra o Batman, é impossível falar de Dark Knight sem reverenciar o Coringa de Heath Ledger, espetacular, atemporal, ele é a personificação do coringa, o qual não quer matar o batman, ou expor ele, só quer a diversão em meio a loucura, ele não é um orquestrador, para ele, o caos reina.

A adaptação do 2 caras foi perfeita, sou muito fã do Harvey Dent e toda sua construção culmina no real ápice do filme.

Gordon, Harvey, Coringa, Fox, Bruce, Alfred todos fantásticos

You either die a hero or you live long enough to see yourself become the villain.

How about a magic trick?
Ta-daa! It's... it's gone.

Sometimes the truth isn't good enough, sometimes people deserve more. Sometimes people deserve to have their faith rewarded...

In their last moments, people show you who they really are.

Why so serious?

Let me get this straight, you think that your client, one of the wealthiest and most powerful men in the world, is secretly a vigilante, who spends his nights beating criminals to a pulp with his bare hands, and your plan is to blackmail this person?
Good luck.

The night is darkest just before the dawn. And I promise you, the dawn is coming.

Because he's the hero Gotham deserves, but not the one it needs right now. So we'll hunt him. Because he can take it. Because he's not our hero. He's a silent guardian, a watchful protector. A dark knight.

I make my own luck","namementioned, l",2025-07-24
2025-07-25,The Godfather Part II,1974,https://boxd.it/asZRN5,5,,"I don't feel I have to wipe everybody out, Tom. Just my enemies.

Em relação a aspectos técnicos, é um filme perfeito, personagens super desenvolvidos, ritmo bom, narrativa espetacular, ação, drama, suspense, algo memorável historicamente, eterno

Mas, acredito, que esse filme tem muitas mais camadas pessoais que qualquer coisa, desde a traição de um membro da família, até a sensação de nunca estar seguro e, por fim, algo que muitas vezes é inevitável ao atingir o “sucesso”, a solidão.

Michael Corleone passa por tudo isso e é irônico como ao mesmo tempo ele era o menos propício, visto que era o mais novo e fora dos negócios, como também sempre foi tido altas expectativas por todos, representado na última ceia pelo descontentamento de Sonny e expectativa do <i>consigliere </i>e do Don Vito Corleone

Também amei a história do Vito Andolini, imigrante, sem ninguém, conquistou seu espaço através da inteligência e ação e se sacramentou através da palavra, respeito e “bondade”.

A verdade é que essa saga toda é muito maquiavélica e isso me enche os olhos.","pinguas, luigimec",2025-07-24
2025-07-26,The Dark Knight Rises,2012,https://boxd.it/atlImj,4.5,Yes,"A melhor trilogia de um herói da história.

Bruce Wayne e o Batman são muito mais complexos do que aparentam, mas é incrível como todas as pontas soltas são fechadas, magnífico

A hero can be anyone. Even a man doing something as simple and reassuring as putting a coat around a young boy's shoulders to let him know that the world hadn't ended.",l,2025-07-25
2025-07-26,The Batman,2022,https://boxd.it/atAHib,5,Yes,"A introdução desse filme é o melhor anúncio de um super herói na história do cinema. A ambientação e visual do Batman também são PERFEITOS, me agradam muito, pra um filme inicial, conseguiram abranger tudo muito bem, o monólogo final é muito impactante e também demonstra que por mais icônica que seja a frase “ i’m vengeance” que o batman é muito mais que isso e que, principalmente, gotham precisa de mais que isso.

Gosto muito do teor investigativo e misterioso desse filme, mas, ao mesmo tempo, sinto que faltou “ameaça” ao batman, porém, como primeiro filme, acho mais apropriado e por isso não é nenhum demérito.

They think I'm hiding in the shadows, but I am the shadows.

Our scars can destroy us, even after the physical wounds have healed. But if we survive them, they can transform us. They can give us the power to endure, and the strength to fight.

 Fear is a tool. When that light hits the sky, it's not just a call. It's a warning.

 I'm starting to see now. I have had an effect here... but not the one I intended. Vengeance won't change the past, mine or anyone else's. I have to become more. People need hope. To know someone's out there for them.","l, namementioned",2025-07-25
2025-07-27,Four Weddings and a Funeral,1994,https://boxd.it/auKroL,2.5,,"nao entendi se era um romance ou comedia, mas não é um romcom

eu e cavszinha demos um show de resenha

VAI GOSTAR DE CASAMENTO ASSIM NA PQP!!",lia 💍,2025-07-27
2025-07-28,Bring Her Back,2025,https://boxd.it/avvpA5,4,,"Mais um bom filme de terror dos irmãos e, dessa vez, achei melhor ainda( BHB > T2M), um dos melhores filmes do gênero dos últimos anos, consegue ser bizarro, agonizante e, principalmente, ter uma história sólida

Andy sofreu muito pqp","l, namementioned",2025-07-27
2025-07-28,Vertigo,1958,https://boxd.it/avFgbl,5,,"Uma pequena mentira e muito sentimento leva a pessoa ao extremo, que clássico!

Gostei da trilha, fotografia, do aspecto investigativo e cauteloso

Vertigo; sensation of whirling and loss of balance, associated particularly with looking down from a great height;","l, namementioned",2025-07-27
2025-07-29,Tenet,2020,https://boxd.it/aw5Btd,3,,"Ao meu ver, teve uma vibe parecida com Inception, mas usando outros artefatos pra simular um ""mundo alterado"", nesse caso, a entropia reversa de entidades, senti que a proposta não foi tão bem explorada, lento e superficial, assim, dificultando que o espectador se aprofunde no universo e nas condições dessa realidade

Robert pattinson é realmente diferenciado, né

we are the people saving the world from what might’ve been","l, namementioned",2025-07-28
2025-07-31,The Killer,2023,https://boxd.it/axQYP5,3.5,,"Amei a caracterização do personagem e seus monólogos 

No fim, temos que jogar com o sistema

the smiths!!",l,2025-07-30
2025-08-02,Jurassic World Rebirth,2025,https://boxd.it/azuAA5,2,,eu também queria ter um triceratops de estimação,"cine, cine25, ospinos",2025-08-01
2025-08-04,The Lego Batman Movie,2017,https://boxd.it/aAZg5n,3.5,Yes,lembrava ser mais legal,ospinos,2025-08-03
2025-08-05,Spider-Man 2,2004,https://boxd.it/aBPf43,4,Yes,we wont tell nobody,l,2025-08-04
2025-08-06,V/H/S/2,2013,https://boxd.it/aCU74t,2.5,,"O CACHORRO NAO


<i>fita 1- parece um episódio dark de black mirror</i>
<i>
fita 2- achei generico, mas gostei do final</i>
<i>
fita 3- o anticristo vem de uma seita indiana e de uma traicao do seu melhor amigo</i>
<i>
fita 4- muito ruim nada a ver mas tinha um cachorro</i>",pinguas,2025-08-05
2025-08-09,Fantastic Mr. Fox,2009,https://boxd.it/aF3YqD,4.5,Yes,"Boggis, Bunce, and Bean
One fat, one short, one lean
These horrible crooks, so different in looks
But nonetheless equally mean","fefys, lia 💍, namementioned",2025-08-08
2025-08-10,War of the Worlds,2025,https://boxd.it/aFj8ch,0.5,,É o pior filme da história,l,2025-08-09
2025-08-10,Batman: Mask of the Phantasm,1993,https://boxd.it/aFF6cD,4,,Muito bom,l,2025-08-10
2025-08-10,Weapons,2025,https://boxd.it/aFFjmV,4,,"Filme foi muito bem desenvolvido, adorei as narrativas paralelas em suas próprias linhas de tempo até a intercessão entre elas.

De cara, o filme te traz muitas perguntas e todas são respondidas com maestria, eu já havia gostado de barbarian, mas, em weapons, ele se supera

Mesmo tendo 2/3 jumpscares, claramente não é o intuito do filme.
O mistério/suspense está ali e te deixa motivado pra acompanhar o filme de perto, pois sabe que as ideias estão se entrelaçando afim de chegar a resposta que, no começo parecia nebulosa, porém, no fim, sempre esteve ali.

Ainda chegando ao final, uma comicidade inesperada preenche bem o filme, deu pra se divertir 

O que não gostei: Acho que poderia ter um intuito melhor pra tudo isso: Certo, ela estava doente e essa “possessão” poderia curar ela, mesmo assim, acho que dava pra ter sido aprofundado isso… ou todos eram simplesmente armas e só?


Muito feliz para onde o terror está indo, estamos tendo ótimos filmes e é mais gratificante ainda começar a conhecer os diretores, pois estão emplacando filmes bons constantemente 


Deve ter sido muito foda ser ator mirim nesse filme","julio, cine, cine25, namementioned",2025-08-09
2025-08-11,Batman: Hush,2019,https://boxd.it/aH0Xf7,3.5,,Hush hush,l,2025-08-11
2025-08-12,The Death of Superman,2018,https://boxd.it/aHupf3,3.5,,pensei que ia me emocionar mais,l,2025-08-11
2025-08-12,Modern Times,1936,https://boxd.it/aHx63D,4,Yes,atemporal,l,2025-08-07
2025-08-13,Reign of the Supermen,2019,https://boxd.it/aHPHuH,1.5,,Muito engessado até o final,l,2025-08-12
2025-08-13,Batman & Mr. Freeze: SubZero,1998,https://boxd.it/aI3jcR,4,,Its a shame victor fries will never know,l,2025-08-12
2025-08-13,Batman: Mystery of the Batwoman,2003,https://boxd.it/aI9UEv,3,,"raso e envolvente 
legal serem três",l,2025-08-12
2025-08-14,Batman: Under the Red Hood,2010,https://boxd.it/aIAiSN,4,,O melhor até agora,l,2025-08-13
2025-08-14,Batman: The Killing Joke,2016,https://boxd.it/aIBE2r,1.5,,"tirando 2 cenas, horripilante",l,2025-08-13
2025-08-14,"Batman: The Long Halloween, Part One",2021,https://boxd.it/aIDz4L,3,,"Muito sólido, mas o traço é muito ruim em alguns personagens como no coringa",l,2025-08-13
2025-08-14,"Batman: The Long Halloween, Part Two",2021,https://boxd.it/aJ1dyR,3.5,,"All we get is all we take

I make my own luck

2 caras é o melhor vilão de batman",l,2025-08-14
2025-08-15,Batman: Year One,2011,https://boxd.it/aJgqVT,4,,Muito legal mostrar a introdução do Gordon também,,2025-08-14
2025-08-15,Batman Beyond: Return of the Joker,2000,https://boxd.it/aJhup5,3.5,,"IT'S NOT BATMAN THAT MAKES YOU WORTHWHILE
IT'S THE OTHER WAY AROUND.",l,2025-08-14
2025-08-15,"Batman: The Dark Knight Returns, Part 1",2012,https://boxd.it/aJAaQj,3.5,,Os mutantes são tão ridículos que dá nojo,l,2025-08-14
2025-08-15,"Batman: The Dark Knight Returns, Part 2",2013,https://boxd.it/aJFUIP,3.5,,"Esperava muito mais

esse superman não dá
Parte do coringa é muito boa, final tem muita ação, mas também deixa um pouco a desejar",l,2025-08-15
2025-08-18,Captain America: The Winter Soldier,2014,https://boxd.it/aLWoSl,3.5,Yes,"ele só é o líder dos vingadores, o primeiro vingador e o héroi da marvel com o melhor código moral

ntj é o cabra

Cenas de ações desse filme são muito boas

Não vou brigar com você
Você é meu amigo


Because you need us.",lia 💍,2025-08-17
2025-08-19,Johnny English,2003,https://boxd.it/aMCMKz,3,,final desse filme é mt bom,"ospinos, namementioned",2025-08-18
2025-08-19,The Matrix,1999,https://boxd.it/aMPfQ1,4.5,,"Contexto foda, realidade foda, personagens fodas, cenas fodas, final foda 

Keanu Reeves","l, namementioned",2025-08-19
2025-08-22,Superman,1978,https://boxd.it/aOxN3T,3.5,,"<i>Superman cares about everybody</i>

Achei o começo muito lento e alguns efeitos engessados de mais ( mesmo pra época), mas é tão clássico, a música, as falas, a essência, é lindo.

Melhor Clark Kent & Superman dos cinemas.",l,2025-08-21
2025-08-22,Justice League: The Flashpoint Paradox,2013,https://boxd.it/aOXBZX,3.5,,muito foda esses paradoxos temporais do flash nostalgia dms,"lia 💍, pinguas, fefys",2025-08-21
2025-08-23,Batman Begins,2005,https://boxd.it/aPwktZ,3.5,Yes,"<blockquote><i>I never said thank you
And you’ll never have to</i></blockquote>",lia 💍,2025-08-23
2025-08-24,F1,2025,https://boxd.it/aQlKID,3,Yes,brad pitt aura farming,"lia 💍, fefys, marquin, lia seb",2025-08-24
2025-08-25,The Dark Knight,2008,https://boxd.it/aR7Den,5,Yes,I make my own luck,"lia 💍, namementioned",2025-08-24
