Date,Name,Year,Letterboxd URI,Rating,Rewatch,Review,Tags,Watched Date
2025-08-26,Full Metal Jacket,1987,https://boxd.it/aRnxDX,4.5,,"A primeira parte é um 5/5 e a segunda é um 4/5

Essa primeira metade é apaixonante demais

<blockquote>If I die in a combat zone,</blockquote><blockquote>Box me up and ship me home</blockquote><blockquote>Pin my medals upon my chest</blockquote><blockquote>And tell my mama I done my best</blockquote>The duality of man. The Jungian thing, sir.","ospinos, namementioned",2025-08-25
2025-08-26,The Dark Knight Rises,2012,https://boxd.it/aRNa43,4,Yes,A hero can be anyone. Even a man doing something as simple and reassuring as putting a coat around a young boy's shoulders to let him know that the world hadn't ended.,lia 💍,2025-08-25
2025-08-28,Nobody,2021,https://boxd.it/aSFELp,3.5,,"Who the hell are you
Nobody... Short story long: I used to be what tey call an auditor for that three letter agencies

Teria sido um ótimo filme pra eu ver com meu pai","l, namementioned",2025-08-27
2025-08-29,The Da Vinci Code,2006,https://boxd.it/aTfci7,2.5,,"Vai ver o santo graal é a amiga que fizemos pelo caminho 

Queria ter gostado mais e que tivesse mais fundamentos reais, mas tem umas cenas bem legais de criptografia/charadas/descobertas 

E eu também tava com uma visão diferente sobre o filme, expectativa me fez diminuir a nota tbh","lia 💍, marquin",2025-08-27
2025-08-29,Dunkirk,2017,https://boxd.it/aTrrDD,3.5,,"Um velho que perdeu seu filho vai pra costa francesa em meios a bombardeios, naufrágios e guerra para salvar mais filhos de outros velhos


Ao mesmo tempo que dá pra ver a desumanização que é a guerra, dá também pra se ter a esperança por meio de atos assim, ainda mais que foi um movimento, gera esperança. Assim como o último inglês ficando, ou como as forças aéreas não terem desistido",l,2025-08-28
2025-09-01,The Batman,2022,https://boxd.it/aVUtrl,5,Yes,"I'm starting to see now. I have had an effect here... but not the one I intended. Vengeance won't change the past, mine or anyone else's. I have to become more. People need hope. To know someone's out there for them.",lia 💍,2025-08-31
2025-09-02,Batman vs. Two-Face,2017,https://boxd.it/aWcMhP,1.5,,"Raso, decepcionante e traço HORRÍVEL",l,2025-09-01
2025-09-02,Justice League: Doom,2012,https://boxd.it/aWeNz5,3.5,,"I do have a plan
Its Called the Justice League

OS PLANOS DE CONTIGÊNCIA DO BATMAN SÃO MUITO FODASSSSSSSSSSSSSSSSSSSSSSSSSSSSSSSSSS

ELE É MUITO FODA E O SUPERMAN TAMBÉM",l,2025-09-01
2025-09-02,Son of Batman,2014,https://boxd.it/aWvYwZ,2.5,,Bem okayzinho,l,2025-09-01
2025-09-02,Batman vs. Robin,2015,https://boxd.it/aWFWYn,3,,"Plot é muito bom e a corte das corujas é muito interessante, mas esse filme tem tantas inconsistências que diminuem muito seu valor

Impressionante como o Asa noturna sempre é sub-usado também..

Final é bom, é bom ter fé, é bom se conhecer 
Alfred de escopeta foi engraçado 
Batman fã do David lean também",l,2025-09-02
2025-09-03,Stalker,1979,https://boxd.it/aXdvX1,5,,"Nunca tinha visto nenhum filme do Tarkosvky, muito menos um filme russo, eu não sabia do que se tratava o filme e estava há mais de 1 ano para vê-lo. Eu tinha muitas expectativas, entretanto, pouca noção do que me aguardava.

Três homens embarcam em uma aventura, a ida a <i>The Zone</i>, um local inóspito e anecúmeno, o qual,  se competente, se leve, se flexível e se respeitoso pode te levar a <i>The Room</i>, onde seu maior ( e único) desejo interior é realizado, uma salvação!? ( Ou um teste para verdade)

<blockquote><b>Hardness and strength are death's companions.
Flexibility and softness are the embodiment of life.
That which has become hard shall not triumph.</b></blockquote>No filme é dito que nenhum homem volta de <i>The Zone</i> e isso é uma fala perfeita e contundente, ou morrem por lá, ou, da mesma forma que o barco de Teseu nunca é o mesmo, e que nunca se banha do mesmo rio, ninguém nunca volta igual de <i>The Zone</i>, especialmente os <i>Stalkers</i>, pessoas experientes que conhecem a área e que, por código de conduta padrão, evitam a <i>The Room</i>, apenas guiam os visitantes até lá.

Acho muito marcante todo o gradiente do filme, a cidade é morta e amarelada, enquanto, por mais abandonada que seja, <i>The Zone</i> é verde, tem cor e tudo oriundo de lá me fascina, o detalhismo presente nesse filme é de outro nível, dá vontade de tentar entender cada ângulo, cada zoom, cada frame, cada objeto posicionado, cada diálogo e até adivinhar o real motivo e estado dos personagens por trás dessa ida.

Como, por exemplo, uma que só fui perceber após refletir sobre o filme: Por que o escritor levaria uma arma se não tem ninguém e nem nenhuma ameaça viva na The Zone? Tudo indica que para uso próprio.

Em The Zone o caminho mais rápido nem sempre é uma linha reta, daí surge a importância dos <i>Stalkers</i> que não só guiam o escritor e físico, como nos guiam durante essa aventura com atuações perfeitas dos 3 principais e também da mãe e filha.

Chegando na <i>The Room</i> o professor apresenta uma bomba e fala que vai destruir a sala pois ela é uma ameaça para a humanidade nas mãos erradas e que facilmente poderia ser usado para o mal, então, daí surge um ponto interessante: O que falamos é realmente o que sentimos? Seria essa a verdadeira natureza dele ter ido até ali? Ou seria apenas uma desculpa externada?

Diante disso, é necessário lembrar do caso de Porcupine: Ele era um <i>Stalker</i>, portanto, sequer deveria entrar a <i>The Room</i>, mas, por urgência, segundo ele, para curar seu irmão, sua maior razão, decide ir até ela, porém, ao retornar ao mundo, percebe que ele estava rico, ou seja, o verdadeiro maior desejo dele nunca foi o irmão.
Chocado pelo próprio egoísmo, Porcupine se mata.

Abordando o próprio escritor e o motivo dele ter ajudado a separar o Stalker da bomba: 

<blockquote><b>A man writes because he is tormented, because he doubts. He needs to constantly prove to himself and the others that he's worth something. And if I know for sure that I'm a genius? Why write then? What the hell for?</b></blockquote>Escritores são pessoas que são movidos pela curiosidade, pelo sentimento, pelas possibilidades, como ele poderia retornar o seu prazer de escrever se, do dia pra noite, ele se torna um gênio? Se ele descobre a resposta pra antropologia? Sobre a vida extraterrestre? Sobre a morte? Não se teria, logo, com medo, ele apoia o físico e sua bomba na reta final.

Físico e Professor, como fundamento do <i>logos</i>, também é alguém que é cientificista e que desacredita e desaprova da fé, todo aquele discurso era apenas um ensaio, uma desculpa que comprova que os dois não estavam dispostos a correr riscos e, por mais infelizes que estavam, pois estavam, eram o pior dos piores caso, porque sequer tinham esperança da salvação, da dinamicidade, eles temem que a <i>The Room </i>revelaria seus desejos mais profundos e revelaria que existe algo místico de fato, expondo a pequenez e fragilidade da razão sob a remota possibilidade de existir algo maior que ela.

Ao voltarem e ao chegar em casa, a esposa do <i>Stalker</i> fala sobre como a felicidade só existe em meio a lamentação e, de fato, é melhor viver uma vida “azeda” de complicações que nós escolhemos do que se arrepender da mesmice para sempre, no fim, não existe felicidade máxima sem conhecer a tristeza profunda e nunca vai existir esperança se você nunca esteve perto da perdição.

<blockquote><b>Mama used to say: ""he's a stalker, a marked man, an eternal jailbird. Remember the kind of children stalkers have."" I didn't even argue. I knew all about it, that he was a marked man, a jailbird. I knew about the kids. Only what could I do? I was sure I'd be happy with him. I knew there'd be a lot of sorrow, but I'd rather know bitter-sweet happiness, than a grey, uneventful life. Perhaps I invented all this later. But when he come up to me and said: ""Come with me"", I went. And I've never regretted it. Never. There was a lot of grief, and fear, and pain, but I've never regretted it, nor envied anyone. It's just fate. It's life, it's us. And if there were no sorrow in our lives, it wouldn't be better, it would be worse. Because then there'd be no happiness, either. And there'd be no hope.</b></blockquote>Por fim, temos a última cena, onde mostra a filha, que sempre foi retratada colorida, com alguma forma de telecinese, a explicação sensata dos poderes é que os <i>Stalkers</i> entram em contato com a área e isso os afeta posteriormente, gerando filhos “defeituosos”, só que, ao meu ver, a filha é a prova de que a <i>The Room</i> é real e que a esperança existe, o quão complementar é alguém imóvel ser capaz de manipular coisas? O verdadeiro poder dela é, mesmo tendo essa condição, se manter com fé. Não é por ela ter os poderes que ela tem esperança, é por ela ser quociente do Stalker, da mãe e <i>da Zona</i> que ela tem esperança e, portanto, tem os seus poderes.

Se eu pudesse descrever esse filme em uma palavra seria: Fé

<blockquote><b>There's nothing else left to people on Earth. This is the only place to come to when all hope is gone.</b></blockquote>","l, namementioned, profile",2025-09-02
2025-09-05,Jeepers Creepers,2001,https://boxd.it/aY728F,2.5,,tava dando nada e até me surpreendi,"l, namementioned",2025-09-04
2025-09-05,OLIVIA RODRIGO: driving home 2 u (a SOUR film),2022,https://boxd.it/aYkpOF,4,,"O maior debut álbum da história 
O álbum feminino com mais streams e com mais faixas com mais de 1B de streams

Devastation & Youth
Pop & Rock",l,2025-09-04
2025-09-07,Come and See,1985,https://boxd.it/aZHX6d,5,,"<blockquote>But the most memorable review of this movie came from an elderly German man that Klimov recalled standing up at a post-film discussion. He declared that he was “a soldier of the Wehrmacht; moreover, an officer of the Wehrmacht. I traveled through all of Poland and Belarus, finally reaching Ukraine. I will testify: everything that is told in this film is the truth.” He went on to note that “the most frightening and shameful thing for me is that this film will be seen by my children and grandchildren.” May we all act as if the ones who come after us will see movies about what we have done in times of great crisis.</blockquote>Filme muito difícil de engolir, a desumanização de uma CRIANÇA, o genocídio de uma nação, a realidade sobre a guerra

Acho que toda pessoa deveria ver esse filme uma vez, especialmente a geração que não passou por essa era e também pela diferença dele em relação a várias outras produções sobre a 2° guerra… sem romantização alguma",lia 💍,2025-09-06
2025-09-11,Night of the Hunted,2023,https://boxd.it/b2g0F7,1.5,,mais um suspense do tiktok visto,l,2025-09-10
2025-09-11,Batman: Year One,2011,https://boxd.it/b2g1zT,4,Yes,O protagonismo do Jim Gordon é tão foda,lia 💍,2025-09-10
2025-09-12,Batman: Year One,2011,https://boxd.it/b2LHdx,3.5,Yes,"quem nunca dormiu vendo filme né

",lia 💍,2025-09-11
2025-09-14,Batman: Under the Red Hood,2010,https://boxd.it/b3yKYT,4,Yes,Capuz vermelhoo,lia 💍,2025-09-13
2025-09-14,Batman: Mystery of the Batwoman,2003,https://boxd.it/b3H3rF,3,Yes,plot é mt legalzinho,lia 💍,2025-09-13
2025-09-14,Batman: Mask of the Phantasm,1993,https://boxd.it/b44ws9,4,Yes,classical,lia 💍,2025-09-13
2025-09-16,Batman & Mr. Freeze: SubZero,1998,https://boxd.it/b5oBAB,4,Yes,É uma pena que Victor Fries nunca saberá,lia 💍,2025-09-15
2025-09-19,Batman: Hush,2019,https://boxd.it/b6EEgF,3.5,Yes,"hush
 hush hush",lia 💍,2025-09-17
2025-09-23,Monster House,2006,https://boxd.it/b9hiJr,2.5,Yes,odiava esse filme,l,2025-09-21
2025-09-25,Caught Stealing,2025,https://boxd.it/baoYqz,3,,"De cara, eu quero destacar o quão bom diretor é o Aronofsky, que, mesmo esse filme não sendo tão brilhante como outros filmes dele são, ainda assim é um filme muito bem fechado, com um final muito bom. Austin Butler também está fantástico nesse papel.  (Zoë Kravitz também , mas com menos tempo de tela)

Eu adoro como os filmes do Aronofsky, muitas vezes, tratam de uma degeneração de pessoas mas também trazem uma visão espiritual sobre isso. (The Whale, Mother,  Pi, Réquiem, Wrestler, A fonte). 

Bom filme sobre trauma e medo",l,2025-09-24
2025-09-25,The Favourite,2018,https://boxd.it/baILNl,4,,Machiavelic af,l,2025-09-24
2025-09-26,Yi Yi,2000,https://boxd.it/bb8MxZ,4.5,,"<blockquote>Nós vivemos três vezes desde que o homem inventou filmes. Significa que o cinema nos dá duas vezes o que nós recebemos da vida. Por exemplo, assassinato. Nós nunca matamos ninguém, mas todos nós sabemos o que é matar. Nós pegamos isso dos filmes</blockquote>Mr Ota e Yangyang são muito fodas","pinguas, marquin, luigimec",2025-09-25
2025-09-27,One Battle After Another,2025,https://boxd.it/bbG90F,4,,"Filme que te prende do início ao fim e com seus “atos” muito bem demarcados e característicos, consegue ser engraçado, sério, agitado e tenso


A perseguição final é marcante e icônica, uma pra história.

Leonardo DiCaprio é geracional
Dar uma chance pra mais filmes do PTA a partir desse","julio, cine25, cine, bento, namementioned",2025-09-26
2025-09-28,No Country for Old Men,2007,https://boxd.it/bbWgpz,4,,"Queria ter gostado mais ainda

Também queria que tivessem abordado mais a psique do Anton, mas é muito bom acompanhar ele, ótimo retrato",l,2025-09-27
2025-09-30,The Elephant Man,1980,https://boxd.it/bdH3i9,5,,"Histórias como essa tem que ser contadas da forma mais cru e real possível

Impressionante como um ser humano totalmente funcional pode ser tão desumanizado só pela sua aparência, a maior lição desse filme é realmente a empatia e até um pouco de esperança

Muito lindo, muito mesmo

Rest in peace John Merrick","l, c",2025-09-29
2025-10-01,The Iron Claw,2023,https://boxd.it/bdZ5vF,4,,"A maldição sendo o narcisismo do pai

Kevin sofreu muito, mas feliz que ele conseguiu ser pros filhos o que não foram pra ele","l, namementioned",2025-09-30
2025-10-01,Mirror,1975,https://boxd.it/beg0lf,5,,"Acho que esse é um filme que não consigo entender inteiramente hoje, afinal, ele trata muito, de forma poética, a reflexões, imagens e sentimentos do seu passado, das suas relações e de como ele interpretava tudo isso, mas, pela visão de hoje

Espero revisitar esse filme pelos próximos anos e quando chegar a minha vez de olhar no espelho, que eu tenha feito tudo do meu jeito, que tenha tratado com amor quem sempre me deu amor, que eu tenha valorizado enquanto pude, que eu tenha arrependimentos, poucos, talvez tão poucos que nem compense falar, mas que seja capaz de olhar pra trás e dar um sorriso a partir de tudo que já vivi e de como algumas coisas nunca mudaram, enquanto, em outras, eu estava completamente errado.

<blockquote>It seems to make me return to the place, poignantly dear to my heart, where my grandfather's house used to be in which I was born 40 years ago right on the dinner table. Each time I try to enter it, something prevents me from doing that. I see this dream again and again. And when I see those walls made of logs and the dark entrance, even in my dream I become aware that I'm only dreaming it. And the overwhelming joy is clouded by anticipation of awakening. At times something happens and I stop dreaming of the house and the pine trees of my childhood around it. Then I get depressed. And I can't wait to see this dream in which I'l be a child again and feel happy again because everything will still be ahead, everything will be possible...</blockquote><blockquote>I don’t believe in premonitions, </blockquote><blockquote>Nor do I fear omens.</blockquote><blockquote>I do not flee from slander,</blockquote><blockquote>Nor from venom.</blockquote><blockquote>There is no death on earth.</blockquote><blockquote>All are immortal. Everything’s immortal.</blockquote><blockquote>Don’t be afraid of death at seventeen,</blockquote><blockquote>Nor at seventy.</blockquote><blockquote>There is only reality and light.</blockquote><blockquote>There is no darkness, nor death on this earth.</blockquote><blockquote>We have all reached the shore already,</blockquote><blockquote>And I am one of those who pull in the nets</blockquote><blockquote>When a shoal of immortality comes.</blockquote><blockquote>You know, I fell and found strange things here - roots, bushes... Has it ever occurred to you that plants can feel, know, even comprehend? The trees, this hazelnut bush...
This is an alder tree.
It doesn't matter. They don't run about. Like us who are rushing, fussing, uttering banalities. That's because we don't trust nature that is inside us. Always this suspiciousness, haste, and no time to stop and think.</blockquote>","l, c",2025-09-30
2025-10-02,A Clockwork Orange,1971,https://boxd.it/beAhm5,4,,"<b>A primeira parte desse filme é totalmente nojenta  e grotesca.</b>

Entendo o uso de violência em filmes e até entendo que isso é complacente com a fala da enfermeira “ se tudo isso te incomoda, você é saudável”, então, a partir disso, já dá pra entender qualquer pessoa que odiou esse filme.

E eu, especificamente, não consigo empatizar em NADA com o protagonista, então vou fazer minha leitura a partir dos outros aspectos do filme

Filme representa muito bem em elementos visuais, sonoros e meta-físicos, tudo é bem inserido e tem seu sentido (leite, autoritarismo, sagrado, profano, política, maldade, subversão, natureza humana) 

Gosto muito do título, pois ele já remete a algo mecânico e forçado, como o tratamento, e, indo mais a fundo, como casos de lobotomia, é como o padre disse: Se você não faz a distinção moral das coisas, você nunca será bom, nunca será livre e nunca será um ser-humano.

Filme também aborda muito bem a subversão humana e essa tentativa incessante de se tirar vantagem de tudo,  tendo um final bem satírico com sobreposição, pois tudo que ele fez volta pra ele, também, obviamente, envolvendo manipulação política e da imprensa = sociedade

Sei que essa forma apelativa e violenta deve ser proposital, mas também acho que atrapalha e afasta bastante no geral, tem ótimos aspectos, mas acaba sendo um bloqueio avassalador

A única mensagem que fica é que a era moderna é realmente muito fodida de inúmeras maneiras",l,2025-10-01
2025-10-02,The Fly,1986,https://boxd.it/beN3ip,3.5,,que nojo do caralho,"l, namementioned",2025-10-01
2025-10-03,Cloverfield,2008,https://boxd.it/bfmEQX,3.5,,"queria ter metade da dedicação desse hud
começo desse filme é mt engraçado e desenvolve mt bem os personagens","marquin, luigimec, lia 💍, pinguas",2025-10-02
2025-10-04,10 Cloverfield Lane,2016,https://boxd.it/bfHKVr,3.5,,"Quem diria que eu ia ver os cloverfields do pior pro melhor


Confesso que esses 2 últimos me surpreenderam bastante e esse aqui é mt sólido",l,2025-10-03
2025-10-05,Triangle,2009,https://boxd.it/bgK4fj,3.5,Yes,"Vendo de novo ainda acho bom o plot e o final é MUITO BOM, mas me irritou muito a lentidão da protagonista em enteder/encarar o paradoxo 

Maioria dos filmes de plot twist tem dependência do plot twist e tudo bem também",lia 💍,2025-10-04
2025-10-07,Weapons,2025,https://boxd.it/bic8Gt,4,Yes,Alex é a criança mais inteligente da história dos filmes de terror,"pinguas, marquin, tori, luigimec",2025-10-06
2025-10-08,Scary Stories to Tell in the Dark,2019,https://boxd.it/bislYn,2,,"filme com talk-no-jutsu no final e a bruxa era só uma vítima = genérico

TEM O FVCKIN HANK

A IRMA DO CARA QUASE MORRE 
ELE: MY SISTER IS GONE
IRMAO?????????",l,2025-10-07
2025-10-08,Trick 'r Treat,2007,https://boxd.it/biv9aV,3,,"Estética do Sam é muito foda!

Olhando de forma isolada as histórias não são tão boas, mas a intercessão final em relação a tragédia é muito boa",l,2025-10-07
2025-10-08,Twilight,2008,https://boxd.it/biLIhp,3.5,,"Como é o primeiro filme acho que a régua pra julgar é menor

Claro que têm atuações horríveis, efeitos ruins, cenas com erros de continuação e etc, mas ao mesmo tempo é muito viciante, engraçado e até curioso ( como é o primeiro filme sem erros de passar por cima de coisas já estabelecidas)



Se olharmos como romcom sobrenatural é ok

Daria até meia estrela a mais pelo Robert Pattinson ele é mt foda coringão",lia 💍,2025-10-07
2025-10-09,Evil Dead II,1987,https://boxd.it/bj2X5H,4,,"<blockquote><b><i>SWALLOW THIS</i></b></blockquote>

Ash deve ser um dos melhores protagonistas de filme de terror da história pqp",l,2025-10-08
2025-10-09,The Twilight Saga: New Moon,2009,https://boxd.it/bjkeDl,1,,"Umas coisas não fazem sentido, o final mesmo, nem se fala, efeitos ruins e todo mundo parece meio bobao sei la",lia 💍,2025-10-08
2025-10-10,The Twilight Saga: Eclipse,2010,https://boxd.it/bjQFn9,1,,aquela cena depois da tenda foi muito feia,lia 💍,2025-10-09
2025-10-11,V/H/S/Halloween,2025,https://boxd.it/bka1LF,2,,"Gostei da fita 1,3,5

mas mesmo abordando a temática halloween achei todos mt repetitivos sei lá","tori, pinguas",2025-10-10
2025-10-12,The Twilight Saga: Breaking Dawn – Part 1,2011,https://boxd.it/bkYQ3J,1,,"CARA TEM 4 COISAS INTANKAVEIS NESSE FILME

1. E.J e RENE+ESME
2. IMPRINTING COM UM BEBE 
3. RENASCEU DE MAQUIAGEM
4. BRASILLLLLLL",lia 💍,2025-10-11
2025-10-12,The Twilight Saga: Breaking Dawn – Part 2,2012,https://boxd.it/bl5yTr,2.5,,"A THOUSAND YEARS É MT FODÃO TE AMO MÃE

ALICE DEU GAPINHO",lia 💍,2025-10-11
2025-10-13,Bring Her Back,2025,https://boxd.it/bm3CSH,4,Yes,um dos maiores ragebaits da história,"lia 💍, pinguas, marquin",2025-10-12
2025-10-14,Scary Movie,2000,https://boxd.it/bmIPpP,3.5,Yes,UM DOS MAIORES FILMES TRASH DA HISTÓRIA,lia 💍,2025-10-13
2025-10-15,Dawn of the Dead,1978,https://boxd.it/bn2re9,3.5,,"Entendo o quão clássico o filme é e como ele ditou o gênero, mas não gostei tanto",l,2025-10-14
2025-10-16,Scary Movie 2,2001,https://boxd.it/bntuVz,1,,mt ruim filho,lia 💍,2025-10-14
2025-10-16,A Film by Kirk,2002,https://boxd.it/bnOITJ,3.5,,vibe meio eraserhead sabe,lia 💍,2025-10-15
2025-10-17,House of Wax,2005,https://boxd.it/bobVXb,3,,OKzao maiúsculo,"l, namementioned",2025-10-16
2025-10-18,Saw,2004,https://boxd.it/boJL1z,4.5,Yes,"Most people are so ungrateful to be alive
but not you
not anymore


JOHN KRAMER",l,2025-10-17
2025-10-18,Singin' in the Rain,1952,https://boxd.it/bp1Dd9,4,,"Não gosto muito de musicais, mas é inegável a importância e aspectos clássicos desse

Gostei mais do começo","lia 💍, luigimec, marquin, pinguas, namementioned",2025-10-17
2025-10-18,Lost and Found,1996,https://boxd.it/bp6rUb,4,,"Muito legal as percepções 

Sr Minhoca acha de 10-20% dos seus objetos e mesmo assim sempre se demonstra otimista e esperançoso, sempre aproveitando o processo em vez de apenas o “booleano”

Sra Chai tinha 30% de chance de morrer (70% de viver) e mesmo assim sequer confiava na maior probabilidade.

O fim do filme é perfeito, cada pedaço da vida é mágico e toda a conexão disso com a natalidade é perfeita, ela criou tanta esperança no mundo que confiou seu bebê a ele

A vida é algo único, vale a pena viver e talvez o caminho importe mais que a chegada, a gratidão é uma clareza mental libertadora","marquin, luigimec, lia 💍, qvt, namementioned",2025-10-18
2025-10-20,Mother,2009,https://boxd.it/bqGPNJ,3.5,,esse final foi totalmente meh,"namementioned, lia 💍, pinguas, marquin, luigimec",2025-10-19
2025-10-21,The Strange Thing About the Johnsons,2011,https://boxd.it/br505L,0.5,,isso é tenebroso que nojo que horror cara,l,2025-10-20
2025-10-25,Constantine,2005,https://boxd.it/btNuZF,3.5,,keanu reeves é mt fodao catolico apostolico romano,"lia 💍, pinguas, marquin",2025-10-24
2025-10-26,Incantation,2022,https://boxd.it/buEwQB,3.5,Yes,"A proposta desse filme é muito foda

É um chamado","marquin, tori, qvt, luigimec",2025-10-26
2025-10-27,The Batman vs. Dracula,2005,https://boxd.it/bvti5X,3,,I am the darkness 🦇 x 🧛‍♂️,l,2025-10-26
2025-10-28,Bridget Jones's Diary,2001,https://boxd.it/bw9HrX,2,,"nao estava muito no clima nao
mas a trilha sonora é boa",lia 💍,2025-10-27
2025-10-30,Elite Squad,2007,https://boxd.it/bx64iF,4,Yes,Corrupção e o crime organizado são dois dos quatro maiores cânceres do Brasil,l,2025-10-29
2025-10-30,Elite Squad: The Enemy Within,2010,https://boxd.it/bx9JGJ,4.5,,"O buraco é muito mais embaixo

O 1° é obviamente muito mais impactante, mas esse 2° é tecnicamente muito melhor e mais concreto com seu objetivo",l,2025-10-29
2025-10-30,City of God,2002,https://boxd.it/bxucwN,4.5,,A story about rio,l,2025-10-29
2025-11-01,The Invisible Guest,2016,https://boxd.it/byKzyt,4,Yes,O melhor do Oriol Paulo,ospinos,2025-10-31
