Date,Name,Year,Letterboxd URI,Rating,Rewatch,Review,Tags,Watched Date
2023-09-29,Saw X,2023,https://boxd.it/4Uxxq9,3.5,,"História muito bem desenvolvida e sem pontas soltas. O John Kramer de Saw I está de volta. Provavelmente se passa entre Saw I e Saw II e, sabendo disso, torna muito legal de se analisar, principalmente a relação entre ele e Amanda. Adorei a exploração da condição de “se” no “jogo” do Zelador. Acho que as máquinas poderiam ser mais incisivas, esse fica como meu único adendo. Bem utilizados os dilemas morais e éticos envolvidos.
E, por fim, uma imensidão de  falas memoráveis do Kramer.",,2023-09-28
2023-12-12,The Lobster,2015,https://boxd.it/5jnjC1,3.5,,"Filme com ótimas criticas a relacionamentos modernos e ao pensamento de que “ ter algo em comum” seja algo físico, ou mais pessoal como gosto indique algo, também ilustra bem como a mentira, por mais boba que seja, indica o declínio de um relacionamento.
Gosto demais da forma que o Yorgos deixa alguns dilemas em abertos, abrindo portas tanto para supostos prenúncios, quanto para teorias dos espectadores, amplia muito o teor da cena e, consequentemente, constrói momentum, expectativa e tensão.

Ainda sim, falta algo, não sei o que, mas sei que falta algo.","nathalia, lia seb",2023-12-11
2023-12-13,The Hunt,2012,https://boxd.it/5jyOwZ,5,,"Um dos melhores filmes que já vi em toda a minha vida, extraordinariamente lógico, intuitivo e real.
Sem palavras.",l,2023-12-12
2023-12-14,Dogville,2003,https://boxd.it/5k5Neh,5,,"Cachorros mordem, pessoas latem, a natureza é linda.","nathalia, lia seb",2023-12-13
2023-12-15,10 Things I Hate About You,1999,https://boxd.it/5kodzB,3.5,Yes,clichê e fofo,"nathalia, lia seb",2023-12-14
2023-12-16,A Silent Voice: The Movie,2016,https://boxd.it/5kFoRv,3.5,,"Lindo, explora muito bem os traumas, suas consequências, como pessoas diferentes lidam com situações iguais, redenção, bondade e as fraquezas inerte de todo ser humano, muito lindo","painloko, fontesam",2023-12-15
2023-12-17,Green Room,2015,https://boxd.it/5l8hcN,2.5,,fvck nazis,l,2023-12-16
2023-12-18,The Autopsy of Jane Doe,2016,https://boxd.it/5lrSyf,1.5,,"Medíocre, plot ordinário e péssima execução, já vi pelo menos 3 filmes iguais.
Let the sun shine",ospinos,2023-12-17
2023-12-19,"As Above, So Below",2014,https://boxd.it/5lSdtR,1.5,,"Desenvolvimento muito ruim, sem profundidade e mal cria tensão ou expectativa, filme lento e que contei o tempo pra acabar, não gostei, exploraram porcamente os possíveis lados positivos do filme",ospinos,2023-12-18
2023-12-22,Whiplash,2014,https://boxd.it/5n5aAb,5,,"SIMPLESMENTE PERFEITO, ISSO É MÚSICA.",gui,2023-12-22
2023-12-26,Inglourious Basterds,2009,https://boxd.it/5oQcTn,4.5,,"Fvck Nazis, mas agora em um filme bom, o meu primeiro do Tarantino.
Muitas cenas memoráveis, bem contextualizado e detalhista.
Absurdo.
Em um possível rewatch posso aumentar, NECESSITO rever esse.",pinguas,2023-12-23
2023-12-26,Just Another Christmas,2020,https://boxd.it/5oYdFn,3,,filme nacional de comédia kkkkkkkkkkkkk,"nathalia, lia seb",2023-12-26
2023-12-26,Home Alone,1990,https://boxd.it/5oYEkV,4,Yes,"Macaulay Caulkin, eu te amo",ospinos,2023-12-25
2023-12-27,Back to the Future,1985,https://boxd.it/5ptuCd,3.5,Yes,good old movie,ospinos,2023-12-26
2023-12-29,Oppenheimer,2023,https://boxd.it/5qx40z,5,Yes,Melhor filme de 2023.,ospinos,2023-12-28
2023-12-29,Saltburn,2023,https://boxd.it/5qCoDh,3.5,,"Mitomaníaco, nerd, esquisito, psicopata, filha-da-puta, ganancioso e determinado.",nathalia,2023-12-27
2023-12-29,The Hunger Games,2012,https://boxd.it/5qKhyl,4,Yes,"Meu filme favorito da franquia.
Jennifer Lawrence é tão perfeita","nathalia, lia seb",2023-12-29
2023-12-30,Percy Jackson & the Olympians: The Lightning Thief,2010,https://boxd.it/5r0fuN,2,,"Acredito que o filme se perde bastante, principalmente pelo roteiro sem base e por não ter direcionamento suficiente.
Filme é mais engraçado do que eu gostaria, mas tem boas representações visuais e algumas boas cenas ( Medusa e Cassino), porém, peca também em atuação e no ritmo do filme.",l,2023-12-29
2024-01-01,Good Boy,2022,https://boxd.it/5shx7P,1,,"Vou dar 1, mas merecia 1/2, que filme tenebroso",l,2023-12-31
2024-01-01,Transformers,2007,https://boxd.it/5smrG5,2,,odeio tanto essa saga,ospinos,2023-12-31
2024-01-02,Rush Hour,1998,https://boxd.it/5sGQMH,3.5,,kkkkkkkkkkkkkknnn,ospinos,2024-01-02
2024-01-02,Gran Turismo,2023,https://boxd.it/5t15zD,3,,"O automobilismo… Filme clichê, mas bom, gostei do visual e eu te amo, David Harbour",ospinos,2024-01-03
2024-01-04,Mamma Mia!,2008,https://boxd.it/5unpyN,4,,MUSICAIS SEM SER INFANTO-JUVENIS ATÉ QUE TEM POTENCIAL,nathalia,2024-01-04
2024-01-08,A Vampire in the Family,2023,https://boxd.it/5wVMx5,2.5,,"Filme é tudo que o brasileiro médio gosta e tudo que eu espero em uma comédia nacional.
Efeitos visuais bem medíocres.
Daria  uma nota menor, mas o ZICO aparece.",l,2024-01-07
2024-01-08,Aquaman,2018,https://boxd.it/5x40Tl,1.5,Yes,não recomendo,ospinos,2024-01-07
2024-01-08,Pulp Fiction,1994,https://boxd.it/5xgajr,5,,"Simplesmente perfeito, nunca vi um filme ligar tantas “ pontas soltas”, amei a cronologia alternada e as diferentes narrativas que se relacionam.
Personagens e atuações extremamente marcantes com personalidades notáveis.
Tarantino apenas.

SAMUEL L. JACKSON É O BAD MOTHERFUCKER 
<i><b>EZEQUIEL 25:17</b></i>",pinguas,2024-01-08
2024-01-09,Thanksgiving,2023,https://boxd.it/5xP2HZ,3,,"Ótimo slasher, achei melhor até que evil dead rise.
Bem criativo e gostei do gore","gui, pinguas, tori",2024-01-09
2024-01-09,Grown Ups,2010,https://boxd.it/5xPIBT,2,Yes,Bem menos engraçado do que eu lembrava,"tori, gui, pinguas",2024-01-09
2024-01-11,Pi,1998,https://boxd.it/5yPMxl,5,,"Que experiência, nunca vi nada igual. 
Aronofsky é um gênio e retrata muito bem todo lado perturbado do Max, ser em preto e branco colabora muito com a ambientação , mesmo não tendo sido pensado, filme é curto, mas o ritmo é sensacional, e é incrível estar dentro da mente dele até o seu limite físico e mental.
""When I was six my mother told me not to stare into the sun...""
EUREKA!
Moral of the story: Listen to your wife she will give you perspective, meaning you need a break. Otherwise: There will be no order. Only Chaos.",l,2024-01-10
2024-01-11,The Prestige,2006,https://boxd.it/5yVo7v,5,,"<i>Foreshadowing.

Every great magic trick consists of three parts or acts. The first part is called ""The Pledge"". The magician shows you something ordinary: a deck of cards, a bird or a man. He shows you this object. Perhaps he asks you to inspect it to see if it is indeed real, unaltered, normal. But of course... it probably isn't. The second act is called ""The Turn"". The magician takes the ordinary something and makes it do something extraordinary. Now you're looking for the secret... but you won't find it, because of course you're not really looking. You don't really want to know. You want to be fooled. But you wouldn't clap yet. Because making something disappear isn't enough; you have to bring it back. That's why every magic trick has a third act, the hardest part, the part we call ""The Prestige"".</i>


<i>See, sacrifice. That's the price of a good trick. But you wouldn't know anything about that, would you?</i>",l,2024-01-11
2024-01-12,Society of the Snow,2023,https://boxd.it/5zn6zH,4,,"Filme muito bem construído e com ótimo desenvolvimento, eu até preferiria que tivesse mais tempo de filme, pois ainda acho que tinha mais a ser aproveitado, mas isso não prejudica os  144 minutos do filme. Desde o começo é bem realista e retrata muito bem toda a relação e condição dos tripulantes, acompanhando eles por todas dificuldades, pensamentos e possíveis caminhos pra serem resgatados. No fim, isso vem da persistência e da vontade de viver, não existe milagre. Película inteligentíssima de buscar mais o lado psicológico do que o físico, porém, acredito que faltou uma certa taxa de realidade em alguns quesitos visuais, ainda assim, experiência bem emocionante e até esperançosa. Confesso que o final traz uma dose de felicidade, algo como finalizar uma agonia própria, reflexo de se sentir na pele e mente dos passageiros.",,2024-01-12
2024-01-13,Cobweb,2023,https://boxd.it/5zV6TP,3,,Bem previsível,"furrico, nathalia",2024-01-13
2024-01-14,Insomnia,2002,https://boxd.it/5Ar7vN,3,,"Em primeiro lugar, sou muito fã do Al Pacino, atuação muito boa.
MAS, eu gostaria de uma representação mais aparente da sua ""insônia"" e da própria sensação de culpa, entendo o impasse e dilemas colocados, mas o Dt. demorou até demais para cair na real  e, seguindo a mesma lógica, o final foi simples até, bem ""good ending"" ele matar e morrer aceitando sua culpa e não fugindo, novamente, da culpa, faltou algo mais.
Do momento em que a delegada acha a bala, esperaria outro desenvolvimento para um final mais elaborado ( A cena do bar chega a ser ridícula, dela confrontando eles com a bala e TODOS os policiais não darem a mínima pra um projétil de 9MM E NÃO PRA DE UM RÉVOLVER)
FALTA MAGIA.
Mesmo assim, filme bem sólido.","ray, pinguas",2024-01-13
2024-01-14,Se7en,1995,https://boxd.it/5Ayc6x,4.5,,"Gostei muito da ambientação do filme, do ritmo, da atuação, da cinematografia, do roteiro, do suspense, das escolhas visuais, da transparência, do Brad Pitt, do Morgan Freeman e do final.

Fight against evil is destined to be a Pyrrhic victory. But regardless the only thing we can do is fight on whatever the cost. We have no other choice.

""The World is a fine place and worth fighting for.""
 I agree with the second part.","gui, pinguas",2024-01-14
2024-01-15,The Northman,2022,https://boxd.it/5Bb6xl,3,,"Bom filme, comprometimento e determinação do protagonista foram motivadoras, final foi muito bom, mas ODIEI o pace do filme, parecia que não acabava ou que era muito lento...
Boa ambientação e trilha sonora.
Casting ABSURDO, mas acho que tinham mais lacunas pra explorar","furrico, nathalia, lia seb",2024-01-15
2024-01-16,Aquaman and the Lost Kingdom,2023,https://boxd.it/5BuDY3,1,,"Realmente, família é a coisa mais importante do mundo.
Amos meus 2 irmãos e minha irmã, beijo pra vocês.","l, cine",2024-01-15
2024-01-17,All Too Well: The Short Film,2021,https://boxd.it/5Cbq7V,3.5,,"Just Between Us
I Was There",l,2024-01-17
2024-01-17,Folklore: The Long Pond Studio Sessions,2020,https://boxd.it/5CbwkL,4,,"Now I'm in exile, seein' you out",l,2024-01-17
2024-01-20,Fear Street: 1994,2021,https://boxd.it/5DCjKz,1.5,,"TEEN DEMAIS, muito óbvio e entediante.
Simplório.",l,2024-01-19
2024-01-20,Fear Street: 1978,2021,https://boxd.it/5DCkFb,3,,Sadie Sink.,l,2024-01-20
2024-01-20,Get Out,2017,https://boxd.it/5DCzmj,4,Yes,"Jordan Peele.
Get Out é muito coeso, linear e tem vários prenúncios do plot, afinal, ele não é pra ser misterioso. Ótima construção de suspense, cenário e, principalmente, dos personagens.",l,2024-01-20
2024-01-22,Dogville,2003,https://boxd.it/5EPeJV,5,Yes,"Cachorros mordem, pessoas latem, a natureza é linda.

<i>The Political Philosophy of a Dogville
On Dogville by Lars von Trier</i>",l,2024-01-22
2024-01-27,Anatomy of a Fall,2023,https://boxd.it/5GSCR9,5,,"<i><b>Cinéma.</b></i>

Filme que traz precisamente as emoções, realidades e perspectivas do relacionamento, mostra até uma relação invertida da comum, consegue, de forma magnífica, criar o ambiente, tensão, mistério e desenvolvimento dos personagens. Pessoalmente, amei o defensor público ( e o cachorro). Diálogos intrigantes e que, facilmente, poderiam ser vistos, trazendo carinho ou desafetos do espectador para os personagens. Além disso, a ambiguidade presente nas hipóteses e narrativas desde o começo são INTENSAMENTE FIXANTES, prendendo-nos do início ao fim. é incrível.","l, cine",2024-01-26
2024-01-28,Catch Me If You Can,2002,https://boxd.it/5HyX2v,4.5,,"EU CANSEI DE FINGIR, SOU MITOMANÍACO SIM SENHOR",lia 💍,2024-01-27
2024-01-29,Psycho,1960,https://boxd.it/5I8YKZ,4.5,Yes,eu amo QUASE tudo nesse filme ,l,2024-01-28
2024-01-30,(500) Days of Summer,2009,https://boxd.it/5IPtFv,4.5,,"Tudo é coincidência? Things aren’t meant to be?

Cada passo forma uma escada, mas, no fim, a escada nunca acaba, né? Podem mudar de textura, material, formato, cor, ou só o ambiente em torno delas, mas o caminho sempre está lá, basta você ascender? (…)
Eu amo solstícios, porém, talvez, eu venha subestimando equinócios durante minha vida toda… Devo aproveitar as coisas igualmente.

Esse filme me veio a calhar, que <i>coincidência</i>.

just because she likes the same bizarro crap you do doesn’t mean she’s your soulmate.

Destino, ou não, as coisas são como devem ser. 
Essa é a realidade.",l,2024-01-30
2024-01-31,Fear Street: 1666,2021,https://boxd.it/5IYh4Z,2,,"Fecharam as pontas soltas dos ultimos filmes

E eu também faria isso pela Olivia Scott",l,2024-01-30
2024-01-31,Kill Bill: Vol. 1,2003,https://boxd.it/5JfHIF,4.5,,"A vingança é como uma floresta.

A ambientação , narrativa, trilha sonora, desenvolvimento, introdução, conclusão tudo nesse filme beira ao perfeito.

Não gostei tanto dos efeitos visuais e faltou algo mais EXPRESSIVO, um apelo emocional que trouxesse mais identificação ou um apego afetivo pelo filme.",l,2024-01-31
2024-02-01,Kill Bill: Vol. 2,2004,https://boxd.it/5Jp7lZ,4,,"também faria tudo isso pela minha filha
abaixo do primeiro",l,2024-01-31
2024-02-01,Countdown,2019,https://boxd.it/5Jsgir,0.5,,contei o tempo pra essa bomba acabar,,2024-01-31
2024-02-01,The Thing,1982,https://boxd.it/5JuXMN,5,,"Finalmente, o filme perfeito do início ao fim, John Carpenter fez um trabalho incrível e soube criar tensão, paranoia, momentum, oportunidades, explicações, teorias, modus, trazer humanidade e dúvida para todo espectador, já havia assistido o prequel de The Thing, então estava mais familiarizado com o cenário, trama e ambiente, portanto, o filme foi um espetáculo, tudo fazia sentido e se completava, o final é PERFEITO, normalmente não gosto de finais abertos ou ambíguos, mas, para The Thing, não existia final alternativo, esse é o desfecho ideal e que me contentou totalmente.

Um clássico;
A must watch;
Masterpiece.","pinguas, ray",2024-01-31
2024-02-02,The Wolf of Wall Street,2013,https://boxd.it/5JRXIx,4,,"post-modern-wolfstreet-gta


que final incrível",l,2024-02-01
2024-02-02,Past Lives,2023,https://boxd.it/5K4T9J,4.5,,"Past Lives é bem simples, mas traz uma forma de narrar o romance que eu nunca tinha visto antes, a normalidade dos personagens, emoções e até o lado racional ( bem aflorado e evidente) são os que mais se destacam, achei muito lindo o conceito espiritual-abstrato do <i><b>in-yun</b></i> e amei as condições “<i>se</i>” abordadas, porém, novamente, todas com uma maturidade absurda pelos 3 personagens. Chegou a ser algo “<i>agonizante</i>”, só que, nunca, nenhum deles saía da linha, daí vem a frase “ <i>não sabia que doeria tanto gostar do seu marido</i>” , em paralelo ao  marido que reconhece a importância do amigo de infância, na verdade, mais que isso, o primeiro amor de sua esposa.

O filme se desfecha de forma muito consciente, um <b>déjà vu</b> da separação prévia de Nora e Hae-Sung  junto do questionamento:

“  <i>E se está fosse uma vida passada e já fossemos algo além em uma próxima vida, quem você acha que seríamos?</i>”

“ Não sei.”

E, majestosamente, os dois se satisfazem da resposta.

Uma das coisas mais lindas da vida são as inúmeras variações que podemos ter e acho que aí permeia a grande reflexão do filme.",l,2024-02-02
2024-02-02,The Evil Dead,1981,https://boxd.it/5K5nux,3,,"Prefiro o de 2013, mas a eficiência do Sam Raimi foi genial",l,2024-02-02
2024-02-03,Separation,2021,https://boxd.it/5KaiNf,0.5,,divorcio leva os filhos pro pior lugar,l,2024-02-02
2024-02-03,Poor Things,2023,https://boxd.it/5KhLKX,4,,"Poor Things não é uma degustação, ou uma experiência, é um banquete inteiro de aventuras conforme a INGÊNUA e INATA Bella Baxter molda e se caracteriza como pessoa, seu amadurecimento é enaltecido por uma atuação digna de prestigio, além dela, toda a construção de personagens foi totalmente incrível, desde personagens como o Willem Dafoe, até o Mark Ruffalo, o Harry Astley, o comandante, a Swiney, a Sra. Prim, enfim, todos que corroboraram tiveram presença, personalidade e seu papel na construção da Bella Baxter, a reborn Victoria.

Esse filme me lembra muito a Dogville, do Lars Von Triet, mas, em vez de, uma desconstrução da personagem em um local fixo e degenerativo  (cidade de Dogsville), é a PAVIMENTAÇÃO de Bella a partir das suas vivências em inúmeros locais e com várias interações com o mundo e pessoas.
Sem contar que tanto a Nicole Kidman quanto a Emma Stone foram ESSENCIAIS em seus respectivos filmes.

Ambientes muito bem explorados, vestimentas que complementam perfeitamente os cenários, época e uma trilha sonora super harmoniosa com o filme.


Distopias do Yorgos são fabulosas, dignas de se “contar” e, sempre, com um final dominante e incisivo.","l, cine",2024-02-02
2024-02-04,Everything Everywhere All at Once,2022,https://boxd.it/5L2dqt,3.5,,nothing matters,pinguas,2024-02-04
2024-02-05,Taxi Driver,1976,https://boxd.it/5LcW01,4,,"protagonista esquisito, mas boa construção",l,2024-02-04
2024-02-06,Once Upon a Time... in Hollywood,2019,https://boxd.it/5LOqZ3,4,,"Sub-uso da Margot Robbie, mas o DiCaprio e Brad Pitt foram perfeitos.

Eu queria ter um amigo como o Cliff.",l,2024-02-05
2024-02-07,The Purge: Anarchy,2014,https://boxd.it/5M8TCn,2.5,,ele queria mto viver,l,2024-02-06
2024-02-08,The Purge: Election Year,2016,https://boxd.it/5MzKHR,2.5,,"O mais fraco até agora, mas com personagens bem legais até",,2024-02-07
2024-02-08,The First Purge,2018,https://boxd.it/5MOo3v,1.5,,"DEFINITIVAMENTE O PIOR ATÉ AGORA
ISAIAS VC ME IRRITOU TANTO, QUASE DROPEI",l,2024-02-08
2024-02-09,The Forever Purge,2021,https://boxd.it/5MU803,1.5,,um casal de latinos incomoda muito,l,2024-02-08
2024-02-09,Another Round,2020,https://boxd.it/5MZ7Hl,4,,"Thomas Vinterberg, kkkkkkkkkk
Você faz de tudo.

MADDS MIKKELSEN É ASTRO.

Filme muito leve e muito bem produzido, perfeitamente roteirizado, conduzido e com ótimos personagens e construção.

Gostei",l,2024-02-08
2024-02-09,Ocean's Eleven,2001,https://boxd.it/5N8P0N,4,,A motivação de tudo isso é o que deixa o filme melhor,ospinos,2024-02-08
2024-02-10,Django Unchained,2012,https://boxd.it/5NpUMV,5,,"ESSE FILME É PERFEITO, TARANTINO RETOMA, INICIA, DESENVOLVE COMO NINGUÉM, É TÃO SATISFAtÓRIO VER OS PONTOS, AS CENAS QUE, PARECIAM SEM SENTIDOS, TEREM SENTIDOS POSTERIORMENTE, E ISSO VALE PRA CONVERSAS, EXPRESSÕES FACIAIS, VISUAL, BIZARRO.

PERSONAGENS MUITO FODAS E NÃO SEI MAIS O QUE FALAR, 5/5.",ospinos,2024-02-09
2024-02-11,The Prestige,2006,https://boxd.it/5O2RvF,5,Yes,"Rewatching e, definitivamente, é um 5/5, que absurdo de filme",ospinos,2024-02-10
2024-02-13,A Quiet Place,2018,https://boxd.it/5OWZe5,3.5,Yes,"Bom filme, queria que o início fosse mais impactante.",ospinos,2024-02-12
2024-02-13,A Quiet Place Part II,2020,https://boxd.it/5OXub7,3,Yes,Cillian murphy eu te amo tanto,ospinos,2024-02-12
2024-02-15,Coherence,2013,https://boxd.it/5PYiXf,4,Yes,6^8*3 realidades e eu fico com ela em todas,ospinos,2024-02-24
2024-02-26,La La Land,2016,https://boxd.it/5V7R8z,4,,meudeusesquecidareview,l,2024-02-14
2024-05-19,The Beekeeper,2024,https://boxd.it/6v14jF,2.5,,"após 3 meses sem ver filmes, eu retorno.

o que caralhos é um beekeeper",ospinos,2024-05-18
2024-05-20,About Time,2013,https://boxd.it/6vuBIr,3.5,,"ai se eu pudesse…..

to com uma vibe romantica",ospinos,2024-05-19
2024-05-21,La La Land,2016,https://boxd.it/6vJU3H,4,Yes,Musicais keep impressing,l,2024-05-20
2024-05-22,Eternal Sunshine of the Spotless Mind,2004,https://boxd.it/6w9D3R,3.5,,"everybody’s gotta learn sometime…
i’m not a impulsive person but",l,2024-05-21
2024-05-22,Requiem for a Dream,2000,https://boxd.it/6wnvMH,4.5,,q porra é essa,"gui, pinguas, tori, marquin",2024-05-21
2024-05-23,Punch-Drunk Love,2002,https://boxd.it/6wIyNF,4,,"Esse filme tem muitas camadas… inicialmente, vi ele como alguém estranho, impulsivo e ansioso.

então, eureka… filme retrata muito bem como pode ser a vivencia de uma pessoa com extrema ansiedade social na meia idade, que se desenvolveu em família completamente feminina e que não teve conexões sociais profundas ao decorrer da sua vida, resultando em alguém inexperiente e inseguro, mas que, causa estranheza, pois contrasta com a sua idade e com o comum.

ÓTIMO FILME E PERFEITA ATUAÇÃO DE ADAM SANDLER.","lia 💍, joulker",2024-05-22
2024-05-23,Enemy,2013,https://boxd.it/6wLMg7,4,,"nós somos nossa própria fonte de medo…
nós somos nosso maior inimigo…
nós somos várias pessoas em uma só…

A História sempre se repete…
Hegel ……

Fidelidade?",l,2024-05-22
2024-05-25,Primer,2004,https://boxd.it/6xlV13,4,,"that’s peakfiction

MINDBLOWING

q filme bom pqp",l,2024-05-24
2024-05-26,The Fall Guy,2024,https://boxd.it/6xN2ZD,3.5,,"ryan gosling tu é mt foda pqp

I WAS MADE FOR LOVIN YOU","marquin, pinguas, tori",2024-05-25
2024-05-26,It Lives Inside,2023,https://boxd.it/6xNmtR,1.5,,a imigração e seus problemas,,2024-02-08
2024-05-26,When Evil Lurks,2023,https://boxd.it/6xSLub,4,,TOMARAM NÓ TÁTICO DA MALDADE,"fefelios, pinguas, gui, tori, mael, marquin",2024-05-25
2024-05-27,The Nice Guys,2016,https://boxd.it/6yysbX,4,,"RYAN GOSLING É ASTRO PQP
POR MAIS FILMES LEVES","joulker, lia 💍",2024-05-26
2024-05-28,Her,2013,https://boxd.it/6yHkOZ,3,,"que odio desse filme pqp
Catherine sempre esteve certa
vc é um burro e seu OS é uma puta",l,2024-05-27
2024-05-28,Primer,2004,https://boxd.it/6yVrUj,4.5,Yes,esse filme é genial pqp,l,2024-05-27
2024-05-28,[REC],2007,https://boxd.it/6yYYrb,4,Yes,"e o ronaldinho que driblou a infecção kkkkkkkkk

acho que é meu found footage favorito","pinguas, gui, tori, marquin, mael",2024-05-27
2024-05-29,[REC]³ Genesis,2012,https://boxd.it/6z8ToV,2,,"essa merda nem found footage é, mas eu casaria mt com a noiva",l,2024-05-28
2024-05-29,[REC]⁴ Apocalypse,2014,https://boxd.it/6zhb4v,1,,"essa merda nao é found footage, nao tem boa gravacao, nao é engracada, tem personagens burros e é uma merda",l,2024-05-28
2024-05-29,Oldboy,2003,https://boxd.it/6zoiuT,4.5,,"tudo nesse filme é perfeito
MAS NAO DA 
NAO DA
QUE PORRA DE VINGANÇA É ESSA","pinguas, gui, marquin, tori",2024-05-28
2024-05-30,"Crazy, Stupid, Love.",2011,https://boxd.it/6zCbw7,4.5,,esse filme curou minha depressao,l,2024-05-29
2024-05-31,Prisoners,2013,https://boxd.it/6zZBxB,4,,"previsível, mas bem construído.
Sinceramente? Esperava muito mais kkk",l,2024-05-30
2024-06-01,I Choose to Believe,2023,https://boxd.it/6AjbdP,4,,"tinha muito tempo que não chorava vendo algo…

As vezes eu me pergunto: 
Será que esse foi o dia mais feliz de toda a minha vida? E, sinceramente, não sei responder…

LIONEL ANDRÉS MESSI, TE QUIERO MUCHO",l,2024-05-31
2024-06-01,Captains of the World,2023,https://boxd.it/6AroTl,3.5,,eu nao seria nada sem voce messi,l,2024-05-31
2024-06-01,The Silence of the Lambs,1991,https://boxd.it/6AwFVN,4,,have the lambs stopped screaming?,"gui, pinguas, tori",2024-05-31
2024-06-02,No One Will Save You,2023,https://boxd.it/6AY40h,3,Yes,trauma healing program by alternative sources,"julio, malu",2024-06-01
2024-06-05,The Grand Budapest Hotel,2014,https://boxd.it/6Cd9hB,3.5,,ÜDVÖZÖLJÜK WES ANDERSON!,pinguas,2024-06-11
2024-06-06,Totally Killer,2023,https://boxd.it/6Cu4An,3,,se fosse melhor eu nao dormia,"marquin, pinguas, tori",2024-06-05
2024-06-26,Orphan,2009,https://boxd.it/6KzllL,2.5,,anti-children propaganda,l,2024-06-18
2024-06-30,The Butterfly Effect,2004,https://boxd.it/6M4dbp,4,,"Qual será meu maior efeito borboleta?
Abdicar é mais...","leto, lia seb, kauan, lia 💍",2024-06-30
2024-07-01,Hell House LLC,2015,https://boxd.it/6MyU1R,1,,medo de palhaço é tao 00's,"tori, lia 💍, nathalia",2024-07-01
2024-07-02,A Tale of Two Sisters,2003,https://boxd.it/6MXALl,4,,eu entendo ela,"lia seb, nathalia, pinguas, tori",2024-07-02
2024-07-03,V/H/S,2012,https://boxd.it/6N7wVh,3,Yes,"As três primeiras fitas são mt boas, mas sinto que o resto não e muito menos o “mundo real”","pinguas, tori, lia seb",2024-07-02
2024-07-03,The Uninvited,2009,https://boxd.it/6N86Xt,1,,a americanizacao,l,2024-07-02
2024-07-04,It Comes at Night,2017,https://boxd.it/6NDKmT,1.5,,"Tediante, mais do mesmo, comum, ordinário, previsível e ruim.

Única coisa que gosto é a determinação de Paul, de resto? Nada.",l,2024-07-03
2024-07-04,The Sixth Sense,1999,https://boxd.it/6NMrSJ,3,,uma das melhores atuações mirins q eu já vi,"lia seb, lia 💍, pinguas, nathalia",2024-07-04
2024-07-06,Timecrimes,2007,https://boxd.it/6Oothh,4,,eu amo tanto viagem no tempo e suas (compl)implicações,l,2024-07-05
2024-07-06,The Happening,2008,https://boxd.it/6OvqQn,1.5,,"q filme rui
bizarro como a Zooey é linda",l,2024-07-05
2024-07-06,Hamilton,2020,https://boxd.it/6OAqjD,4.5,,"What if this bullet is my legacy?
Legacy, what is a legacy?
It's planting seeds in a garden you never get to see…

<i>I am not throwin' away my shot</i>","nathalia, pinguas",2024-07-05
2024-07-07,Signs,2002,https://boxd.it/6OMuaT,2.5,,"esperava mais, bem monótono",l,2024-07-06
